<?xml version="1.0" encoding="UTF-8" standalone="no"?><!-- <!DOCTYPE contacts 
	SYSTEM "contact.dtd"> --><!-- xmlns="www.520it.com" 
	xmlns:xsi="http://www.w3.org/2001/XMLSchema-instance" xsi:schemaLocation="www.520it.com 
	contact.xsd"> --><contacts>
	<linkman id="a1">
		<name>西门官人</name>
		<email>xy@163.com</email>
		<address>大西门</address>
		<group>水浒</group>
	</linkman>
	<linkman id="a2">
		<name>东方姑娘</name>
		<email>dongfang@163.com</email>
		<address>黑木崖</address>
		<group>笑傲江湖</group>
	</linkman>
	<linkman id="8527">
		<name>宝宝</name>
		<email>bb@126.com</email>
		<address>帝都</address>
		<group>演员</group>
	</linkman>
	<linkman>
		<name>宝宝</name>
		<email>bb@126.com</email>
		<address>帝都</address>
		<group>演员</group>
	</linkman>
<linkman><name>宝宝</name><email>bb@126.com</email><address>帝都</address><group>演员</group></linkman></contacts>