<?xml version="1.0" encoding="UTF-8"?>
<!DOCTYPE contacts SYSTEM "contact.dtd">
<contacts>
	<linkman id="a1">
		<name>西门官人</name>
		<email>ximen@163.com</email>
		<address>大西门</address>
		<group>水浒</group>
	</linkman>
	<linkman id="a2">
		<name>东方姑娘</name>
		<email>dongfang@163.com</email>
		<address>黑木崖</address>
		<group>笑傲江湖</group>
	</linkman>
</contacts>

